"August 9, 2022",Carr Joins Sullivan in Alaska,Carr Joins Senator Sullivan in Alaska with Broadband Officials,News Relea,"Media Relations, Office of Commissioner C","Events Focus on Expanding Connectivity, Telehealth, Workforce, and New Federal Program",https://docs.fcc.gov/public/attachments/DOC-386086A1.pdf,https://www.fcc.gov/document/carr-joins-sullivan-alaska
"August 8, 2022","FCC Opens Proceeding On Servicing, Assembly, & Manufacturing In Space","Space Innovation; Facilitatig Capabilities for In-space Servicing, Assembly, and Manufacturing",Noti,International,unknown,https://docs.fcc.gov/public/attachments/FCC-22-66A1.pdf,https://www.fcc.gov/document/fcc-opens-proceeding-servicing-assembly-manufacturing-space-0
"August 8, 2022",FCC Establishes Affordable Connectivity Outreach Grant Program,Affordable Connectivity Program,Report and Order,Wireline Competition,unknown,https://docs.fcc.gov/public/attachments/FCC-22-64A1.pdf,https://www.fcc.gov/document/fcc-establishes-affordable-connectivity-outreach-grant-program-0
"August 8, 2022","FCC Creates 'Your Home, Your Internet' Pilot Program",Affordable Connectivity Program,Report and Order,Wireline Competition,unknown,https://docs.fcc.gov/public/attachments/FCC-22-65A1.pdf,https://www.fcc.gov/document/fcc-creates-your-home-your-internet-pilot-program-0
"August 5, 2022",FCC Proposes Q Link Fine for Non-Response to Data Security Inquiry,CC Proposes Fine Against Q Link For Failing To Respond To Inquiries Into Reported Data Breach,News Relea,"Enforcement, Media Relation",unknown,https://docs.fcc.gov/public/attachments/DOC-386006A1.pdf,https://www.fcc.gov/document/fcc-proposes-q-link-fine-non-response-data-security-inquiry-0
"August 5, 2022",FCC Urges EAS Participants to Secure EAS Equipment,Public Safety and Homeland Security Bureau Urges Emergency Alert System (EAS) Participants to Take Immediate Steps to Secure EAS Equipmen,Public Noti,Public Safety and Homeland Security,unknown,https://docs.fcc.gov/public/attachments/DA-22-828A1.pdf,https://www.fcc.gov/document/fcc-urges-eas-participants-secure-eas-equipment
"August 4, 2022",Carr Applauds PLAN for Broadband Act,"Carr Applauds Introduction of Bipartisan, Bicameral ""PLAN for Broadband Act""",Sta,"Media Relations, Office of Commissioner C",Bill Would Require President to Develop National Broadband Strategy and Implementation Pla,https://docs.fcc.gov/public/attachments/DOC-385961A1.pdf,https://www.fcc.gov/document/carr-applauds-plan-broadband-act
"August 3, 2022",FCC Updates 17 GHz Rules to Support Spectrum for Satellite Broadband,"Amendment of Parts 2 and 25 of the Commission's Rules to Enable GSO Fixed-Satellite Service (Space-to-Earth) Operations in the 17.3-17.8 GHz Band, to Modernize Certain Rules Applicable to 17/24 GHz BSS Space Stations",R&O/NPRM,International,unknown,https://docs.fcc.gov/public/attachments/FCC-22-63A1.pdf,https://www.fcc.gov/document/fcc-updates-17-ghz-rules-support-spectrum-satellite-broadband
"August 3, 2022","Deletion of Item From August 5, 2022 Open Meeting","Deletion of Item From August 5, 2022 Open Meeting",Sunshi,Managing Directo,Sunsh,https://docs.fcc.gov/public/attachments/DOC-385871A1.pdf,https://www.fcc.gov/document/deletion-item-august-5-2022-open-meeting
"August 2, 2022",FCC Identifies Tentative Selectees for New NCE FM Stations,Comparative Consideration of 27 Groups of Mutually Exclusive Applications  for Permits to Construct New Noncommercial Educational FM Stations,Memorandum Opinion and Order,Medi,unknown,https://docs.fcc.gov/public/attachments/FCC-22-61A1.pdf,https://www.fcc.gov/document/fcc-identifies-tentative-selectees-new-nce-fm-stations
"August 2, 2022","FCC, NTIA Sign New MOU on Spectrum Coordination","CC, NTIA Sign New Memorandum Of Understanding On Spectrum Coordination",News Relea,"Media Relations, Office of Chairwoman Rosenworcel",Updated MOU Will Help Revitalize the Interagency Spectrum Coordination Process to Once Again Produce Results for Consumers and the Economy,https://docs.fcc.gov/public/attachments/DOC-385873A1.pdf,https://www.fcc.gov/document/fcc-ntia-sign-new-mou-spectrum-coordination
"August 1, 2022",FCC Fines Electronics Marketer for Selling Noncompliant Wireless Mics,CC Fines New York Electronics Marketer for Selling Noncompliant Wireless Devices,News Relea,"Enforcement, Media Relation","Ignored Warnings, Incomplete Responses to Investigators, and Selling Devices Operating in Unauthorized Spectrum Bands Results in a Nearly $700K F",https://docs.fcc.gov/public/attachments/DOC-385823A1.pdf,https://www.fcc.gov/document/fcc-fines-electronics-marketer-selling-noncompliant-wireless-mics
"August 1, 2022","Deletion of Items From August 5, 2022 Open Meeting","Deletion of Items From August 5, 2022 Open Meeting",Sunshi,Managing Directo,Sunsh,https://docs.fcc.gov/public/attachments/DOC-385822A1.pdf,https://www.fcc.gov/document/deletion-items-august-5-2022-open-meeting
"August 1, 2022","FCC Consumer Advisory Committee Next Meeting Date, Time, and Agenda","CC Consumer Advisory Committee Announcement of Next Meeting Date, Time, and Agenda",Public Noti,Consumer and Governmental Affai,unknown,https://docs.fcc.gov/public/attachments/DA-22-808A1.pdf,https://www.fcc.gov/document/fcc-consumer-advisory-committee-next-meeting-date-time-and-agenda
"July 29, 2022","FCC To Hold Open Commission Meeting Friday, August 5, 2022","CC To Hold Open Commission Meeting Friday, August 5, 2022",Sunshi,Managing Directo,Sunsh,https://docs.fcc.gov/public/attachments/DOC-385772A1.pdf,https://www.fcc.gov/document/fcc-hold-open-commission-meeting-friday-august-5-2022
"July 29, 2022",FCC Starts 5G Mid-Band Spectrum Auction,CC Starts 5G Mid-Band Spectrum Auction,News Relea,"Economics and Analytics, Media Relations, Wireless Telecommunication",First-of-Its-Kind Overlay Auction of 2.5 GHz Licenses Offers Opportunity to Fill in the Spectrum Gaps in Rural Wireless Coverag,https://docs.fcc.gov/public/attachments/DOC-385771A1.pdf,https://www.fcc.gov/document/fcc-starts-5g-mid-band-spectrum-auction
"July 28, 2022",Chairwoman Rosenworcel Statement On Net Neutrality Legislation,Chairwoman Rosenworcel Statement On Net Neutrality Legislation,Sta,"Media Relations, Office of Chairwoman Rosenworcel",unknown,https://docs.fcc.gov/public/attachments/DOC-385734A1.pdf,https://www.fcc.gov/document/chairwoman-rosenworcel-statement-net-neutrality-legislation
"July 28, 2022",Starks Statement On Introduction Of Net Neutrality Legislation,Statement Of Geoffrey Starks On Today's Introduction of the Net Neutrality and Broadband Justice Ac,Sta,"Office of Commissioner Starks, Media Relation",unknown,https://docs.fcc.gov/public/attachments/DOC-385733A1.pdf,https://www.fcc.gov/document/starks-statement-introduction-net-neutrality-legislation
"July 28, 2022",FCC Warns Consumers of Rising Threat of Scam Robotexts,Alert: Scam Robotexts Are Rising Threa,Consumer Advisor,"Enforcement, Media Relations, Consumer and Governmental Affai","Text Message Scammers Seek Money, Information, and Engagem",https://docs.fcc.gov/public/attachments/DOC-385732A1.pdf,https://www.fcc.gov/document/fcc-warns-consumers-rising-threat-scam-robotexts
"July 27, 2022",FCC Announces $77 Million In Emergency Connectivity Funding,CC Announces $77 Million In Emergency Connectivity Funding For Schools And Libraries To Help Close The Homework Gap,News Relea,"Consumer and Governmental Affairs, Media Relations, Wireline Competition",Nearly 13 Million Students Benefitting from Program Providing Digital Services for Students in Communities Across the Country,https://docs.fcc.gov/public/attachments/DOC-385699A1.pdf,https://www.fcc.gov/document/fcc-announces-77-million-emergency-connectivity-funding
"July 27, 2022",FCC Announces New Chief Information Officer,CC Announces Allen Hill As FCC Chief Information Officer,Sta,"Managing Director, Media Relation",unknown,https://docs.fcc.gov/public/attachments/DOC-385696A1.pdf,https://www.fcc.gov/document/fcc-announces-new-chief-information-officer
"July 22, 2022",FCC Proposes Fines of $4.3M Against 73 RDOF Applicants for Defaults,CC Proposes $4.3 Million In Fines Against 73 Rural Digital Opportunity Fund Applicants That Defaulted On Bids In Apparent Violation Of FCC Rules,News Relea,"Enforcement, Wireline Competition, Media Relation",faults Prevented Funding to Build Broadband in Rural Area,https://docs.fcc.gov/public/attachments/DOC-385581A1.pdf,https://www.fcc.gov/document/fcc-proposes-fines-43m-against-73-rdof-applicants-defaults
"July 22, 2022","WRC Advisory Committee Schedules 6th Meeting for September 12, 2022","World Radiocommunication Conference Advisory Committee Schedules Its Sixth Meeting On September 12, 2022",Public Noti,International,unknown,https://docs.fcc.gov/public/attachments/DA-22-791A1.pdf,https://www.fcc.gov/document/wrc-advisory-committee-schedules-6th-meeting-september-12-2022
"July 22, 2022",FCC Sets Revised Agenda for July 22 Diversity Council Meeting,"CC Announces Revised Agenda for July 22, 2022 Communications Equity and Diversity Council Meeting",Public Noti,Medi,unknown,https://docs.fcc.gov/public/attachments/DA-22-790A1.pdf,https://www.fcc.gov/document/fcc-sets-revised-agenda-july-22-diversity-council-meeting
"July 21, 2022",FCC Orders Blocking of Auto Warranty Robocall Scam Campaign,CC Orders Blocking Of Auto Warranty Robocall Scam Campaign,News Relea,"Enforcement, Media Relations, Office of Chairwoman Rosenworcel",unknown,https://docs.fcc.gov/public/attachments/DOC-385536A1.pdf,https://www.fcc.gov/document/fcc-orders-blocking-auto-warranty-robocall-scam-campaign
"July 20, 2022",FCC Releases Agenda for July 22 Equity and Diversity Council Meeting,"CC Announces Agenda for July 22, 2022 Communications Equity and Diversity Council Meeting",Public Noti,Medi,unknown,https://docs.fcc.gov/public/attachments/DA-22-783A1.pdf,https://www.fcc.gov/document/fcc-releases-agenda-july-22-equity-and-diversity-council-meeting
"July 19, 2022",Rosenworcel Probes Mobile Carriers on Data Privacy Practices,Chairwoman Roseworcel Probes Top Mobile Carriers On Data Privacy Practices,News Relea,"Media Relations, Office of Chairwoman Rosenworcel",unknown,https://docs.fcc.gov/public/attachments/DOC-385446A1.pdf,https://www.fcc.gov/document/rosenworcel-probes-mobile-carriers-data-privacy-practices
"July 19, 2022",Commissioner Starks Announces Staff Changes,Commissioner Starks Announces Staff Changes,Sta,"Office of Commissioner Starks, Media Relation",unknown,https://docs.fcc.gov/public/attachments/DOC-385434A1.pdf,https://www.fcc.gov/document/commissioner-starks-announces-staff-changes-2
"July 18, 2022",FCC Tribal Workshop August 9-10 in Oklahoma,CC Announces A Tribal Workshop To Be Held August 9-10 At The Cherokee Nation,Public Noti,Consumer and Governmental Affai,unknown,https://docs.fcc.gov/public/attachments/DA-22-777A1.pdf,https://www.fcc.gov/document/fcc-tribal-workshop-august-9-10-oklahoma
"July 18, 2022",FCC Begins Proceeding on Supporting Survivors of Domestic Violence,Lifeline and Link Up Reform and Modernization; Affordable Connectivity Program; Supporting Survivors of Domestic and Sexual Violenc,Notice of Inquir,Wireline Competition,unknown,https://docs.fcc.gov/public/attachments/FCC-22-56A1.pdf,https://www.fcc.gov/document/fcc-begins-proceeding-supporting-survivors-domestic-violence-0
"July 18, 2022",Carr Thanks Michael Nemcik for Serving as Acting Legal Advisor,Carr Thanks FCC Attorney Michael Nemcik for Serving as Acting Legal Advisor,Sta,"Media Relations, Office of Commissioner C",unknown,https://docs.fcc.gov/public/attachments/DOC-385396A1.pdf,https://www.fcc.gov/document/carr-thanks-michael-nemcik-serving-acting-legal-advisor
"July 18, 2022",FCC Establishes Enhanced Competition Incentive Program,"Partitioning, Disaggregation, and Leasing of Spectrum, WT Docket No. 19-38, Report and Order and Second Further Notice of Proposed Rulemaking","Report and Order, FNPRM",Wireless Telecommunication,unknown,https://docs.fcc.gov/public/attachments/FCC-22-53A1.pdf,https://www.fcc.gov/document/fcc-establishes-enhanced-competition-incentive-program-0
"July 18, 2022",FCC Announces Supply Chain Reimbursement Program Approved Applications,Wireline Competition Bureau Announces the Grant of Applications for the Secure and Trusted Communications Networks Reimbursement Program,Public Noti,Wireline Competition,unknown,https://docs.fcc.gov/public/attachments/DA-22-774A1.pdf,https://www.fcc.gov/document/fcc-announces-supply-chain-reimbursement-program-approved-applications
"July 15, 2022",FCC Announces Tentative Agenda for August Open Meeting,CC Announces Tentative Agenda for August Open Meeting,News Relea,"Managing Director, Media Relation","FCC Chairwoman Jessica Rosenworcel announced the items tentatively on the agenda for the August Open Commission Meeting scheduled for Friday, August 5, 2022",https://docs.fcc.gov/public/attachments/DOC-385346A1.pdf,https://www.fcc.gov/document/fcc-announces-tentative-agenda-august-open-meeting-8
"July 15, 2022",FCC Proposes Updated Rules to Eliminate Access Arbitrage,Updating the Intercarrier Compensation Regime to Eliminate Access Arbitrag,FNPRM,Wireline Competition,unknown,https://docs.fcc.gov/public/attachments/FCC-22-54A1.pdf,https://www.fcc.gov/document/fcc-proposes-updated-rules-eliminate-access-arbitrage-0
"July 15, 2022",U.S. Transition to 988 Suicide & Crisis Lifeline Begins July 16,U.S. Transition to 988 Suicide & Crisis Lifeline Begins July 16.  The New Easy-to-Remember 3-Digit Number Provides Access to Suicide Prevention and Mental Health Crisis Services Nationwid,News Relea,"Wireline Competition, Media Relations, Office of Chairwoman Rosenworcel","On Saturday, July 16, the U.S. will transition the 10-digit National Suicide Prevention Lifeline to 988 – an easy-to-remember three-digit number for 24/7 crisis ca",https://docs.fcc.gov/public/attachments/DOC-385324A1.pdf,https://www.fcc.gov/document/us-transition-988-suicide-crisis-lifeline-begins-july-16
"July 15, 2022",Chairwoman Rosenworcel Proposes to Increase Minimum Broadband Speeds,Chairwoman Rosenworcel Proposes To Increase Minimum Broadband Speeds  And Set Gigabit Future Goa,News Relea,"Wireline Competition, Media Relations, Office of Chairwoman Rosenworcel, Economics and Analytic",Proposed Benchmarks Aimed at Giving Public Faster Broadband Serv,https://docs.fcc.gov/public/attachments/DOC-385322A1.pdf,https://www.fcc.gov/document/chairwoman-rosenworcel-proposes-increase-minimum-broadband-speeds
"July 15, 2022",Carr House TikTok Testimony,"stimony Of Brendan Carr Commissioner FCC Before The Subcommittee On National Security Of The US House Of Representatives Committee On Oversight And Reform, ""Protecting Military Servicemembers And Veterans From Financial Scams And Fraud"", July 13, 2022",Testi,"Media Relations, Office of Commissioner C",unknown,https://docs.fcc.gov/public/attachments/DOC-385321A1.pdf,https://www.fcc.gov/document/carr-house-tiktok-testimony
"July 14, 2022",FCC Proposes $116M Robocall Fine for Toll-Free Traffic Pumping Scheme,In the Matter of Thomas Dorsher; ChariTel Inc; OnTel Inc; and ScammerBlaster Inc,"NAL, Notice of Apparent Liability For Forfeitur",Enforcement,unknown,https://docs.fcc.gov/public/attachments/FCC-22-57A1.pdf,https://www.fcc.gov/document/fcc-proposes-116m-robocall-fine-toll-free-traffic-pumping-scheme-0
"July 14, 2022",FCC Proposes to Update Publication Used to Determine Local TV Markets,Update to Publication for Television Broadcast Station DMA Determinations for Cable and Satellite Carriag,Notice of Proposed Rulemaking,Medi,unknown,https://docs.fcc.gov/public/attachments/FCC-22-55A1.pdf,https://www.fcc.gov/document/fcc-proposes-update-publication-used-determine-local-tv-markets
"July 13, 2022",FCC Announces Over $266 Million in Emergency Connectivity Funding,CC Announces Over $266 Million In Emergency Connectivity Funding For Schools And Libraries,News Relea,"Wireline Competition, Media Relations, Consumer and Governmental Affai","To Date, Nearly $5.6 Billion in Funding Committed in Ongoing Work to Close the Homework Ga",https://docs.fcc.gov/public/attachments/DOC-385229A1.pdf,https://www.fcc.gov/document/fcc-announces-over-266-million-emergency-connectivity-funding
"July 13, 2022","Deletion of Item From Thursday, July 14, 2022 Open Meeting","Deletion of Item From Thursday, July 14, 2022 Open Meeting",Sunshi,Managing Directo,"letion of Item From Thursday, July 14, 2022 Open Meeting",https://docs.fcc.gov/public/attachments/DOC-385228A1.pdf,https://www.fcc.gov/document/deletion-item-thursday-july-14-2022-open-meeting
"July 13, 2022",FCC Updates and Proposes Rules for LPTV and TV Translator Stations,"Amendment of Parts 73 and 74 of the Commission's Rules to Establish Rules for Digital Low Power Television and Television Translator Stations, Update of Parts 74 of the Commission's Rules Related to Low Power Television and Television Translator Stations",Order,Medi,unknown,https://docs.fcc.gov/public/attachments/FCC-22-58A1.pdf,https://www.fcc.gov/document/fcc-updates-and-proposes-rules-lptv-and-tv-translator-stations
"July 12, 2022",Chairwoman Rosenworcel on Foreign Sponsorship ID Court Decision,Chairwoman Rosenworcel Statement On Foreign Sponsorship ID Circuit Court Decision,Sta,"Media Relations, Office of Chairwoman Rosenworcel",unknown,https://docs.fcc.gov/public/attachments/DOC-385188A1.pdf,https://www.fcc.gov/document/chairwoman-rosenworcel-foreign-sponsorship-id-court-decision
"July 11, 2022",Chair Rosenworcel Highlights Recent Efforts to Increase Competition,Chairwoman Rosenworcel Highlights FCC's Recent Efforts To Increase Competition,News Relea,"Media Relations, Office of Chairwoman Rosenworcel",unknown,https://docs.fcc.gov/public/attachments/DOC-385135A1.pdf,https://www.fcc.gov/document/chair-rosenworcel-highlights-recent-efforts-increase-competition
"July 11, 2022",Auction 108 (2.5 GHz Band) Qualified Bidders,Auction of Flexible-Use Licenses in the 2.5 GHz Band for Next-Generation Wireless Services; 82 Applicants Qualified to Bid in Auction 108,Public Noti,"Economics and Analytics, Wireless Telecommunication",unknown,https://docs.fcc.gov/public/attachments/DA-22-736A1.pdf,https://www.fcc.gov/document/auction-108-25-ghz-band-qualified-bidders
"July 11, 2022",Chairwoman Rosenworcel Announces Staff Changes,Chairwoman Rosenworcel Announces Staff Changes,News Relea,"Media Relations, Office of Chairwoman Rosenworcel",unknown,https://docs.fcc.gov/public/attachments/DOC-385129A1.pdf,https://www.fcc.gov/document/chairwoman-rosenworcel-announces-staff-changes-1
"July 8, 2022",FCC Proposes Fine Against Verizon for Failure to Produce Documents,CC Takes Enforcement Action Against Verizon Wireless For Not Providing Information Related To Accessibility Of Its Premium Visual Voicemail Servic,News Relea,"Enforcement, Media Relation",Company Failed to Respond to Inquiries Alleging Violation of Accessibility Rul,https://docs.fcc.gov/public/attachments/DOC-385087A1.pdf,https://www.fcc.gov/document/fcc-proposes-fine-against-verizon-failure-produce-documents-0
"July 7, 2022",FCC Takes Actions Against Auto Warranty Scam Robocall Campaign,CC Authorizes Phone Companies To Cut Off Likely Auto Warranty Scam Robocall Campaign; Enforcement Bureau is Investigating an International Operation for Facilitating Billions of Possibly Illegal Robocalls,News Relea,"Enforcement, Media Relations, Office of Chairwoman Rosenworcel","The FCC opened up an investigation, issued cease-and-desist letters to specified providers, and ordered all networks to lookout for auto warranty robocalls generated by Roy Cox, Jr., Aaron Michael Jones, and their Sumco Panama compa",https://docs.fcc.gov/public/attachments/DOC-385038A1.pdf,https://www.fcc.gov/document/fcc-takes-actions-against-auto-warranty-scam-robocall-campaign
"July 7, 2022","FCC To Hold Commission Meeting, Thursday, July 14, 2022","CC To Hold Commission Meeting, Thursday, July 14, 2022",Sunshi,Oth,Sunshine N,https://docs.fcc.gov/public/attachments/DOC-385037A1.pdf,https://www.fcc.gov/document/fcc-hold-commission-meeting-thursday-july-14-2022
"July 6, 2022",FCC Acts to Improve Network Resiliency During Disasters,"Resilient Networks, et al.",R&O/NPRM,Public Safety and Homeland Security,unknown,https://docs.fcc.gov/public/attachments/FCC-22-50A1.pdf,https://www.fcc.gov/document/fcc-acts-improve-network-resiliency-during-disasters
"July 1, 2022",FCC Consumer Advisory Committee Seeks Applications for Membership,CC Announces Anticipated Renewal of its Consumer Advisory Committee and Solicits Nominations for Membership,Public Noti,Consumer and Governmental Affai,unknown,https://docs.fcc.gov/public/attachments/DA-22-710A1.pdf,https://www.fcc.gov/document/fcc-consumer-advisory-committee-seeks-applications-membership
"July 1, 2022",FCC Sets July 22 Communications Equity & Diversity Council Meeting,"CC Announces July 22, 2022 Communications Equity and Diversity Council Meeting",Public Noti,Medi,unknown,https://docs.fcc.gov/public/attachments/DA-22-711A1.pdf,https://www.fcc.gov/document/fcc-sets-july-22-communications-equity-diversity-council-meeting
"July 1, 2022",FCC Proposes a $220K Fine for Apparent Wire Fraud in EBB Program,In the Matter of Kyle Traxler and Cleo Communications,NAL,Enforcement,unknown,https://docs.fcc.gov/public/attachments/FCC-22-52A1.pdf,https://www.fcc.gov/document/fcc-proposes-220k-fine-apparent-wire-fraud-ebb-program
"June 30, 2022",FCC Adopts Four-Year IP Relay Compensation Formula,communications Relay Services and Speech-to-Speech Services for Individuals with Hearing and Speech Disabilities; Petition for Rulemaking of Sprint Corporation,Report and Order,Consumer and Governmental Affai,unknown,https://docs.fcc.gov/public/attachments/FCC-22-48A1.pdf,https://www.fcc.gov/document/fcc-adopts-four-year-ip-relay-compensation-formula
"June 30, 2022","FCC Modernizes VRS and IP CTS Rules, Proposes Further Improvements",communications Relay Services and Speech-to-Speech Services for Individuals with Hearing and Speech Disabilities; Structure and Practices of the Video Relay Services Program; Misuse of Internet Protocol (IP) Captioned Telephone Service; et a,"R&O/NPRM, Order, Declaratory Ruling",Consumer and Governmental Affai,unknown,https://docs.fcc.gov/public/attachments/FCC-22-51A1.pdf,https://www.fcc.gov/document/fcc-modernizes-vrs-and-ip-cts-rules-proposes-further-improvements
"June 30, 2022",FCC Announces Nearly $159 Million In Emergency Connectivity Funding,CC Announces Nearly $159 Million In Emergency Connectivity Funding For Schools And Libraries,News Relea,"Wireline Competition, Media Relations, Consumer and Governmental Affai",Over 12.7 Million Students Benefitting from Program Support in Ongoing Work to Close the Homework Ga,https://docs.fcc.gov/public/attachments/DOC-384802A1.pdf,https://www.fcc.gov/document/fcc-announces-nearly-159-million-emergency-connectivity-funding
"June 30, 2022",Inaugural Broadband Data Collection Filing Window Opens,Inaugural Filing Window for Broadband Data Collection Has Opened,Public Noti,Wireless Telecommunication,unknown,https://docs.fcc.gov/public/attachments/DA-22-696A1.pdf,https://www.fcc.gov/document/inaugural-broadband-data-collection-filing-window-opens
"June 30, 2022",FCC Expands TRS Fund Contribution Base for VRS and IP Relay,communications Relay Services and Speech-to-Speech Services for Individuals with Hearing and Speech Disabilities; Structure and Practices of the Video Relay Service Program; Misuse of Internet Protocol Relay Servic,Report and Order,Consumer and Governmental Affai,unknown,https://docs.fcc.gov/public/attachments/FCC-22-49A1.pdf,https://www.fcc.gov/document/fcc-expands-trs-fund-contribution-base-vrs-and-ip-relay
"June 30, 2022",FCC Closes Robocall Loophole,CC Closes Robocall Loophole: Requiring Non-Facilities Based Small Voice Service Providers to Implement STIR/SHAKEN,News Relea,"Wireline Competition, Media Relation",unknown,https://docs.fcc.gov/public/attachments/DOC-384793A1.pdf,https://www.fcc.gov/document/fcc-closes-robocall-loophole
"June 27, 2022",Starks Remarks At Ericsson's 2022 Broadband For All Summit,"Remarks Of Commissioner Geoffrey Starks Before Ericsson's 2022 Broadband For All Summit, Stockholm, Sweden",Speech,"Office of Commissioner Starks, Media Relation",Speech,https://docs.fcc.gov/public/attachments/DOC-384659A1.pdf,https://www.fcc.gov/document/starks-remarks-ericssons-2022-broadband-all-summit
"June 24, 2022",FCC and Library Agency Sign Agreement to Promote Broadband Access,CC And Institute Of Museum And Library Services Sign Agreement To Promote Broadband Access,News Relea,"Wireline Competition, Media Relation",Partnership to Focus on Expanding Digital Inclu,https://docs.fcc.gov/public/attachments/DOC-384621A1.pdf,https://www.fcc.gov/document/fcc-and-library-agency-sign-agreement-promote-broadband-access-0
"June 23, 2022",Broadband Data Collection System Available for Filer Registration,Broadband Data Task Force Announces Access to the Broadband Data Collection System for Purposes of Registering Filer Information,Public Noti,Wireless Telecommunication,unknown,https://docs.fcc.gov/public/attachments/DA-22-672A1.pdf,https://www.fcc.gov/document/broadband-data-collection-system-available-filer-registration
"June 23, 2022",FCC Announces Tentative Agenda for July Open Meeting,CC Announces Tentative Agenda for July Open Meeting,News Relea,Media Relation,"FCC Chairwoman Jessica Rosenworcel announced the items tentatively on the agenda for the July Open Commission Meeting scheduled for Thursday, July 14, 2022",https://docs.fcc.gov/public/attachments/DOC-384565A1.pdf,https://www.fcc.gov/document/fcc-announces-tentative-agenda-july-open-meeting-9
