"November 16, 2021",FCC Mid-Band Spectrum Auction Successfully Concludes Clock Phase,CC Mid-Band Spectrum Auction in 3.45 GHz Band Successfully Concludes Clock Phas,News Relea,"Media Relations, Economics and Analytics, Wireless Telecommunication",unknown,https://docs.fcc.gov/public/attachments/DOC-377911A1.pdf,https://www.fcc.gov/document/fcc-mid-band-spectrum-auction-successfully-concludes-clock-phase
"November 16, 2021","Deletion Of Item From November 18, Open Meeting","Deletion Of Item From November 18, Open Meeting",Sunshi,Managing Directo,Sunshine N,https://docs.fcc.gov/public/attachments/DOC-377891A1.pdf,https://www.fcc.gov/document/deletion-item-november-18-open-meeting
"November 16, 2021",Simington Condemns Russian Weapon Test,Simington Condemns Russian Weapon Tes,News Relea,"Media Relations, Office of Commissioner Simington",unknown,https://docs.fcc.gov/public/attachments/DOC-377885A1.pdf,https://www.fcc.gov/document/simington-condemns-russian-weapon-test
"November 15, 2021",Commissioner Starks  Applauds Bipartisan Investments In Broadband,Commissioner Geoffrey Starks  Applauds Bipartisan Investments In Broadband,Sta,"Office of Commissioner Starks, Media Relation",unknown,https://docs.fcc.gov/public/attachments/DOC-377852A1.pdf,https://www.fcc.gov/document/commissioner-starks-applauds-bipartisan-investments-broadband
"November 15, 2021",FCC Proposes Changes to FM Directional Antenna Testing Requirements,In the Matter of Updating FM Broadcast Radio Service Directional Antenna Performance Verification,Notice of Proposed Rulemaking,Medi,unknown,https://docs.fcc.gov/public/attachments/FCC-21-117A1.pdf,https://www.fcc.gov/document/fcc-proposes-changes-fm-directional-antenna-testing-requirements
"November 12, 2021",Simington Addresses Massachusetts Broadcasters Association,CC Commissioner Nathan Simington delivered a pre-recorded statement on various broadcast media topics to the Massachusetts Broadcasters Association,News Relea,Media Relation,unknown,https://docs.fcc.gov/public/attachments/DOC-377813A1.pdf,https://www.fcc.gov/document/simington-addresses-massachusetts-broadcasters-association
"November 12, 2021",Carr Applauds President Biden's Signing of the Secure Equipment Act,Commissioner Carr Applauds President Biden's Signing of the Secure Equipment Ac,Sta,Media Relation,unknown,https://docs.fcc.gov/public/attachments/DOC-377811A1.pdf,https://www.fcc.gov/document/carr-applauds-president-bidens-signing-secure-equipment-act
"November 10, 2021","FCC to Hold Open Commission Meeting Thursday, November 18, 2021","CC TO HOLD OPEN COMMISSION MEETING THURSDAY, NOVEMBER 18, 2021",Sunshi,Managing Directo,Sunshine N,https://docs.fcc.gov/public/attachments/DOC-377734A1.pdf,https://www.fcc.gov/document/fcc-hold-open-commission-meeting-thursday-november-18-2021
"November 10, 2021",FCC Announces Over $700 Million for Broadband in 26 States,CC Announces Over $700 Million For Broadband In 26 States Through Rural Digital Opportunity Fund,News Relea,"Wireline Competition, Media Relations, Economics and Analytic",Largest Commitment of Funding to Date as FCC Continues to Ensure Qualified Providers Serve Areas That Need Broadband,https://docs.fcc.gov/public/attachments/DOC-377733A1.pdf,https://www.fcc.gov/document/fcc-announces-over-700-million-broadband-26-states
"November 9, 2021",FCC Reaches $150M Benchmark for COVID-19 Telehealth Program Round 2,CC Reaches $150 Million Benchmark For Covid-19 Telehealth Program Round 2,News Relea,"Wireline Competition, Media Relation",Additional $42.16 Million Awarded To Health Care Provid,https://docs.fcc.gov/public/attachments/DOC-377691A1.pdf,https://www.fcc.gov/document/fcc-reaches-150m-benchmark-covid-19-telehealth-program-round-2-0
"November 8, 2021","WRC Advisory Committee Working Groups 1, 2, 3, & 4 Schedule Meetings","Informal Working Group 1, Informal Working Group 2, Informal Working Group 3, and Informal Working Group 4 of the World Radiocommunication Conference Advisory Committee Schedule Their Meetings",Public Noti,International,unknown,https://docs.fcc.gov/public/attachments/DA-21-1398A1.pdf,https://www.fcc.gov/document/wrc-advisory-committee-working-groups-1-2-3-4-schedule-meetings
"November 8, 2021",FCC Commits $421 Million in Additional Emergency Connectivity Funding,CC Commits Over $421 Million In Additional Funding Through Emergency Connectivity Fund Program,News Relea,"Wireline Competition, Media Relations, Office of Chairwoman Rosenworcel","New Funding Wave Brings Total Commitments to Over $3 Billion, Connecting Over 10 Million Stud",https://docs.fcc.gov/public/attachments/DOC-377637A1.pdf,https://www.fcc.gov/document/fcc-commits-421-million-additional-emergency-connectivity-funding
"November 5, 2021",Carr Backs Bill Supporting Uncensored Internet Abroad,Carr Applauds Senate Introduction of PATRIA Y VIDA Act to Restore Internet Services,News Relea,"Media Relations, Office of Commissioner C",Legislation Would Promote Internet Freedom in Cuba and Advance U.S. Strategic I,https://docs.fcc.gov/public/attachments/DOC-377601A1.pdf,https://www.fcc.gov/document/carr-backs-bill-supporting-uncensored-internet-abroad
"November 5, 2021",FCC Seeks Comment on ATSC 3.0 Multicast Requirements,Authorizing Permissive Use of the 'Next Generation' Broadcast Television Standard,FNPRM,Medi,unknown,https://docs.fcc.gov/public/attachments/FCC-21-116A1.pdf,https://www.fcc.gov/document/fcc-seeks-comment-atsc-30-multicast-requirements
"November 3, 2021",Commissioner Simington Addresses APCO's Emerging Technology Forum,Commissioner Simington Addresses APCO's Emerging Technology Forum,News Relea,"Media Relations, Office of Commissioner Simington",unknown,https://docs.fcc.gov/public/attachments/DOC-377519A1.pdf,https://www.fcc.gov/document/commissioner-simington-addresses-apcos-emerging-technology-forum
"November 3, 2021",FCC Authorizes Boeing Broadband Satellite Constellation,CC Authorizes Boeing Broadband Satellite Constellation,News Relea,Media Relation,unknown,https://docs.fcc.gov/public/attachments/DOC-377518A1.pdf,https://www.fcc.gov/document/fcc-authorizes-boeing-broadband-satellite-constellation
"November 2, 2021",China Telecom Americas Order on Revocation and Termination,China Telecom (Americas) Corporation Order on Revocation and Termination,Order,International,unknown,https://docs.fcc.gov/public/attachments/FCC-21-114A1.pdf,https://www.fcc.gov/document/china-telecom-americas-order-revocation-and-termination
"November 2, 2021",FCC Announces Equity Council Members and Working Group Chairs,Equity Council Members and Working Group Chairs Announced; November 3 Meeting Agenda Released,Public Noti,Medi,unknown,https://docs.fcc.gov/public/attachments/DA-21-1371A1.pdf,https://www.fcc.gov/document/fcc-announces-equity-council-members-and-working-group-chairs
"November 1, 2021",FCC to Extend Application Deadline for Fall 2022 Honors Program,CC to Extend Application Deadline for Fall 2022 Honors Program,Public Noti,General Counsel,unknown,https://docs.fcc.gov/public/attachments/DA-21-1364A1.pdf,https://www.fcc.gov/document/fcc-extend-application-deadline-fall-2022-honors-program
"October 29, 2021",Simington Applauds Passage Of The Secure Equipment Act Of 2021,Commissioner Simington Applauds Passage Of The Secure Equipment Act Of 2021,News Relea,"Media Relations, Office of Commissioner Simington",unknown,https://docs.fcc.gov/public/attachments/DOC-377390A1.pdf,https://www.fcc.gov/document/simington-applauds-passage-secure-equipment-act-2021
"October 29, 2021",FCC Approves Spectrum Licenses to Serve Alaska Native Communities,CC Approves Additional 2.5 GHz Spectrum Licenses To Serve Alaska Native Communities,News Relea,"Media Relations, Wireless Telecommunication",unknown,https://docs.fcc.gov/public/attachments/DOC-377388A1.pdf,https://www.fcc.gov/document/fcc-approves-spectrum-licenses-serve-alaska-native-communities
"October 29, 2021",FCC Opens Filing Window for Supply Chain Reimbursement Program,CC Opens Filing Window For Supply Chain Reimbursement Program,News Relea,"Wireline Competition, Media Relation",$1.9 Billion Program Will Reimburse Providers for Cost of Replacing Equipment and Services That Pose a National Security Threa,https://docs.fcc.gov/public/attachments/DOC-377383A1.pdf,https://www.fcc.gov/document/fcc-opens-filing-window-supply-chain-reimbursement-program
"October 28, 2021",Carr Applauds Final Passage of Secure Equipment Act by U.S. Senate,Carr Applauds Final Passage of Secure Equipment Act by U.S. Sena,Sta,"Media Relations, Office of Commissioner C","Bipartisan Legislation to Close ""Huawei Loophole"" Now Headed to President's Desk",https://docs.fcc.gov/public/attachments/DOC-377380A1.pdf,https://www.fcc.gov/document/carr-applauds-final-passage-secure-equipment-act-us-senate
"October 28, 2021",Chairwoman Rosenworcel Congratulates FCC's Evan Kwerel,Chairwoman Rosenworcel Congratulates Evan Kwerel On Career Achievement Meda,News Relea,"Media Relations, Office of Chairwoman Rosenworcel, Economics and Analytic",unknown,https://docs.fcc.gov/public/attachments/DOC-377348A1.pdf,https://www.fcc.gov/document/chairwoman-rosenworcel-congratulates-fccs-evan-kwerel
"October 28, 2021",FCC Announces Tentative Agenda for November Open Meeting,CC Announces Tentative Agenda for November Open Meeting,News Relea,Media Relation,"FCC Chairwoman Jessica Rosenworcel announced the items tentatively on the agenda for the November Open Commission Meeting scheduled for Thursday, November 18, 2021",https://docs.fcc.gov/public/attachments/DOC-377342A1.pdf,https://www.fcc.gov/document/fcc-announces-tentative-agenda-november-open-meeting-7
"October 28, 2021",Commissioner Simington Addresses Mobile World Congress,Commissioner Simington Addresses Mobile World Congress,Sta,"Media Relations, Office of Commissioner Simington",unknown,https://docs.fcc.gov/public/attachments/DOC-377340A1.pdf,https://www.fcc.gov/document/commissioner-simington-addresses-mobile-world-congress
"October 27, 2021",FCC Announces 36 Newly Approved Connected Care Pilot Program Projects,deral Communications Commission Announces Third Set of Projects Selected for the Connected Care Pilot Program,Public Noti,Wireline Competition,unknown,https://docs.fcc.gov/public/attachments/FCC-21-113A1.pdf,https://www.fcc.gov/document/fcc-announces-36-newly-approved-connected-care-pilot-program-projects-0
"October 27, 2021",FCC to Consider Text-to-988 to Expand Suicide Prevention Services,CC To Consider Text-To-988 To Expand Access To The Suicide Prevention Lifelin,News Relea,"Wireline Competition, Media Relation",New Rules Would Establish July 2022 Deadline to Implement 988 Texting,https://docs.fcc.gov/public/attachments/DOC-377300A1.pdf,https://www.fcc.gov/document/fcc-consider-text-988-expand-suicide-prevention-services
"October 26, 2021",Simington Statement On White House Commission Designations,Commissioner Simington Statement On White House Commission Designations,Sta,"Media Relations, Office of Commissioner Simington",unknown,https://docs.fcc.gov/public/attachments/DOC-376924A1.pdf,https://www.fcc.gov/document/simington-statement-white-house-commission-designations
"October 26, 2021",Chairwoman Rosenworcel Statement on Designation to Lead FCC,Statement of Jessica Rosenworcel on Being Designated as Chair of the Federal Communications Commission by President Biden,Sta,"Media Relations, Office of Chairwoman Rosenworcel",unknown,https://docs.fcc.gov/public/attachments/DOC-376922A1.pdf,https://www.fcc.gov/document/chairwoman-rosenworcel-statement-designation-lead-fcc
"October 26, 2021",Carr on White House Designation of Rosenworcel and Noms,Carr Statement On White House Designation Of Commissioner Jessica Rosenworcel As Chair And Nominations To The FCC,Sta,"Media Relations, Office of Commissioner C",unknown,https://docs.fcc.gov/public/attachments/DOC-376914A1.pdf,https://www.fcc.gov/document/carr-white-house-designation-rosenworcel-and-noms
"October 26, 2021",Statement Of Commissioner Starks On FCC And NTIA Leadership Changes,Statement Of FCC Commissioner Geoffrey Starks On FCC And NTIA Leadership Changes,Sta,"Office of Commissioner Starks, Media Relation",unknown,https://docs.fcc.gov/public/attachments/DOC-376912A1.pdf,https://www.fcc.gov/document/statement-commissioner-starks-fcc-and-ntia-leadership-changes
"October 25, 2021",FCC to Host Webinar Upon Launch of Reassigned Numbers Database Nov. 1,"CC Announces Launch of Reassigned Numbers Database on November 1, 2021 to Reduce Unwanted Calls",News Relea,Consumer and Governmental Affai,"Webinar will educate callers and caller agents about the Reassigned Numbers Database, which will help prevent a consumer from getting unwanted calls intended for someone who previously held their phone numb",https://docs.fcc.gov/public/attachments/DOC-376867A1.pdf,https://www.fcc.gov/document/fcc-host-webinar-upon-launch-reassigned-numbers-database-nov-1
"October 25, 2021",FCC Updates the DTV Table of Allotments and Related Rules,Expanding the Economic and Innovation Opportunities of Spectrum Through Incentive Auction,Order,Medi,unknown,https://docs.fcc.gov/public/attachments/FCC-21-111A1.pdf,https://www.fcc.gov/document/fcc-updates-dtv-table-allotments-and-related-rules
"October 25, 2021",FCC Receives $1.3B in New Emergency Connectivity Fund Applications,CC Announces Nearly $1.3 Billion In Funding Requests Received In Emergency Connectivity Fund Program Second Application Filing Window,News Relea,"Wireline Competition, Media Relations, Consumer and Governmental Affai","An Additional $269 Million Committed, Bringing Total Commitments to Over $2.63 Billion and Connecting Over 9 Million Stud",https://docs.fcc.gov/public/attachments/DOC-376868A1.pdf,https://www.fcc.gov/document/fcc-receives-13b-new-emergency-connectivity-fund-applications
"October 25, 2021","FCC Upholds Cancellation of DKQEK-LP in Cupertino, California","In the Matter of Foundation for a Beautiful Life, Inc., DKQEK-LP, Cupertino California, Application for Covering License and Application for Modification of Construction Permit, Motion for Stay",Memorandum Opinion and Order,Medi,unknown,https://docs.fcc.gov/public/attachments/FCC-21-112A1.pdf,https://www.fcc.gov/document/fcc-upholds-cancellation-dkqek-lp-cupertino-california
"October 22, 2021","Deletion Of Items From October 26, 2021 Open Meeting","Deletion Of Items From October 26, 2021 Open Meeting",Sunshi,Managing Directo,"letion Of Items From October 26, 2021 Open Meeting",https://docs.fcc.gov/public/attachments/DOC-376832A1.pdf,https://www.fcc.gov/document/deletion-items-october-26-2021-open-meeting
"October 21, 2021",FCC Issues Robocall Cease-and-Desist Letters to 3 More Companies,CC Demands Three More Companies Immediately Stop Facilitating Illegal Robocall Campaigns,News Relea,"Enforcement, Media Relation",These Are the Fourth Tranche of Enforcement Bureau Cease and Desist L,https://docs.fcc.gov/public/attachments/DOC-376789A1.pdf,https://www.fcc.gov/document/fcc-issues-robocall-cease-and-desist-letters-3-more-companies
"October 21, 2021",Commissioner Simington Speaks At Cooley Fireside Chat,Commissioner Simington Speaks At Cooley Fireside Cha,News Relea,"Media Relations, Office of Commissioner Simington",unknown,https://docs.fcc.gov/public/attachments/DOC-376788A1.pdf,https://www.fcc.gov/document/commissioner-simington-speaks-cooley-fireside-chat
"October 21, 2021",FCC Announces Third Set of Awards for COVID-19 Telehealth Round 2,CC Announces An Additional $40.46 Million Awarded As Part Of Covid-19 Telehealth Program,News Relea,"Wireline Competition, Media Relation",unknown,https://docs.fcc.gov/public/attachments/DOC-376784A1.pdf,https://www.fcc.gov/document/fcc-announces-third-set-awards-covid-19-telehealth-round-2-0
"October 20, 2021",Carr Applauds House Passage of Secure Equipment Act,Carr Praises House Passage of Scalise-Eshoo Led Secure Equipment Ac,Sta,"Media Relations, Office of Commissioner C",Bipartisan Bill Closes a 'Huawei Loophole' and Heads to Senate Where Similar Bill Pending,https://docs.fcc.gov/public/attachments/DOC-376746A1.pdf,https://www.fcc.gov/document/carr-applauds-house-passage-secure-equipment-act
"October 20, 2021",FCC to Host Consumer Webinar on Robocall Scams in Hawai'i on Oct. 28,CC Announces Virtual Webinar On Spoofing And Robocalls Focused On Hawai'i Consumers,Public Noti,Consumer and Governmental Affai,"In partnership with the Hawai'i Attorney General, the FCC will host a virtual public webinar on spoofing and robocalls. The event will feature state government officials and other Hawai'i-based pa",https://docs.fcc.gov/public/attachments/DOC-376743A1.pdf,https://www.fcc.gov/document/fcc-host-consumer-webinar-robocall-scams-hawaii-oct-28
"October 20, 2021",FCC Announces $554 Million for Broadband in 19 States,CC Announces $554 Million For Broadband In 19 States Through Rural Digital Opportunity Fund Program,News Relea,"Wireline Competition, Media Relations, Economics and Analytic",FCC Continues Ongoing Work to Clean Up and Refocus Program So Funding Goes to Qualified Providers in Areas That Need Broadband,https://docs.fcc.gov/public/attachments/DOC-376745A1.pdf,https://www.fcc.gov/document/fcc-announces-554-million-broadband-19-states
"October 20, 2021",Chairs Announced for FCC Diversity Committee – November 3 Meeting Set,CC Announces The Leadership And First Meeting Of The Communications Equity And Diversity Counc,Public Noti,Medi,unknown,https://docs.fcc.gov/public/attachments/DA-21-1315A1.pdf,https://www.fcc.gov/document/chairs-announced-fcc-diversity-committee-november-3-meeting-set
"October 19, 2021",FCC Sets Agenda of Virtual Field Hearing on Disaster Communications,CC Announces Agenda for October 26 Virtual Field Hearing on Improving Communications Resiliency and Recovery During Disasters,Public Noti,"Public Safety and Homeland Security, Media Relation",The FCC announced the panels and panelists for its October 26 virtual field hearing on improving the resiliency and recovery of communications networks during disasters.,https://docs.fcc.gov/public/attachments/DOC-376706A1.pdf,https://www.fcc.gov/document/fcc-sets-agenda-virtual-field-hearing-disaster-communications
"October 19, 2021","FCC to Hold Open Commission Meeting Tuesday, October 26, 2021","CC to Hold Open Commission Meeting Tuesday, October 26, 2021",Sunshi,Managing Directo,Sunshine N,https://docs.fcc.gov/public/attachments/DOC-376703A1.pdf,https://www.fcc.gov/document/fcc-hold-open-commission-meeting-tuesday-october-26-2021
"October 19, 2021","Carr Calls for Review of DJI, Citing National Security Risks","Citing National Security Risks, Carr Calls For Starting Process Of Adding DJI—A Chinese Drone Company—To FCC's Covered Lis",News Relea,"Media Relations, Office of Commissioner C","JI Drones Are Collecting Vast Troves of Sensitive Data on Americans and U.S. Critical Infrastructure, Potentially Operating as a Huawei on Wing",https://docs.fcc.gov/public/attachments/DOC-376692A1.pdf,https://www.fcc.gov/document/carr-calls-review-dji-citing-national-security-risks
"October 19, 2021",FCC Office of Inspector General Announces New Social Media Accounts,CC Office Of Inspector General Announces New Social Media Accounts,News Relea,"Inspector General, Media Relation",unknown,https://docs.fcc.gov/public/attachments/DOC-376683A1.pdf,https://www.fcc.gov/document/fcc-office-inspector-general-announces-new-social-media-accounts
"October 18, 2021",Acting Chair Rosenworcel Proposes Rules to Combat Rise of Robotexts,Acting FCC Chair Rosenworcel Proposes Rules To Combat Rise Of Robotexts,News Relea,"Wireline Competition, Media Relations, Consumer and Governmental Affairs, Office of Chairwoman Rosenworcel",Mobile Wireless Providers May Be Required to Block Illegal Text Messag,https://docs.fcc.gov/public/attachments/DOC-376657A1.pdf,https://www.fcc.gov/document/acting-chair-rosenworcel-proposes-rules-combat-rise-robotexts
"October 15, 2021",Commissioner Simington to Free State Foundation Anniversary Gala,Remarks Of Commissioner Nathan Simington To The Free State Foundations Fifteenth Anniversary Gala Lunch,Speech,"Media Relations, Office of Commissioner Simington",Speech,https://docs.fcc.gov/public/attachments/DOC-376618A1.pdf,https://www.fcc.gov/document/commissioner-simington-free-state-foundation-anniversary-gala
"October 15, 2021",FCC to Host Tribal Libraries E-Rate Listening Session,"Listening Session for Tribal Leaders, Staff, and Outreach Partners on Expanding Tribal Library Participation in the E-Rate Program",Public Noti,Consumer and Governmental Affai,unknown,https://docs.fcc.gov/public/attachments/DA-21-1303A1.pdf,https://www.fcc.gov/document/fcc-host-tribal-libraries-e-rate-listening-session
"October 15, 2021",Commissioner Simington Speaks At Free State Foundation,Commissioner Simington Speaks At Free State Foundation,News Relea,"Media Relations, Office of Commissioner Simington",unknown,https://docs.fcc.gov/public/attachments/DOC-376614A1.pdf,https://www.fcc.gov/document/commissioner-simington-speaks-free-state-foundation
"October 15, 2021",Carr Congratulates Free State Foundation on Fifteenth Anniversary,Carr Congratulates Free State Foundation on Fifteenth Anniversary,Sta,"Media Relations, Office of Commissioner C",unknown,https://docs.fcc.gov/public/attachments/DOC-376613A1.pdf,https://www.fcc.gov/document/carr-congratulates-free-state-foundation-fifteenth-anniversary
"October 14, 2021",Eight 911 Service Providers to Pay FCC Penalties for Late Filings,Eight 911 Service Providers To Pay FCC Penalties Due To Failure To File Service Reliability Certifications By Last Year's Deadlin,News Relea,"Enforcement, Public Safety and Homeland Security, Media Relation",This Year's Filing Deadline Is October 15,https://docs.fcc.gov/public/attachments/DOC-376571A1.pdf,https://www.fcc.gov/document/eight-911-service-providers-pay-fcc-penalties-late-filings
"October 12, 2021",FCC Commits Another $1.1 Billion from Emergency Connectivity Fund,"CC Commits Over $1.1 Billion In Second Funding Wave Of Emergency Connectivity Fund Program, Funding Over 2.4 Million Devices And 1.9 Million Broadband Connections",News Relea,"Wireline Competition, Media Relation","Today's commitments support 2,471 schools, 205 libraries, and 26 consortia that applied for support from the $7.17 billion Emergency Connectivity Fund Program",https://docs.fcc.gov/public/attachments/DOC-376482A1.pdf,https://www.fcc.gov/document/fcc-commits-another-11-billion-emergency-connectivity-fund
"October 12, 2021",Acting Chair Rosenworcel to Americas Spectrum Management Conference,"Remarks Of Acting Chairwoman Jessica Rosenworcel To The 10th Americas Spectrum Management Conference October 12, 2021",Speech,"Media Relations, Office of Chairwoman Rosenworcel",Speech,https://docs.fcc.gov/public/attachments/DOC-376473A1.pdf,https://www.fcc.gov/document/acting-chair-rosenworcel-americas-spectrum-management-conference
"October 8, 2021",FCC Announces North American Numbering Council Working Group Members,CC Announces Additional Membership to the North American Numbering Council and Membership to the Working Groups,Public Noti,Wireline Competition,unknown,https://docs.fcc.gov/public/attachments/DA-21-1261A1.pdf,https://www.fcc.gov/document/fcc-announces-north-american-numbering-council-working-group-members
"October 7, 2021",FCC Concludes Core Communications Tariff Investigation,"Core Communications, Inc., et al. Tariff F.C.C. No. 3",Memorandum Opinion and Order,Wireline Competition,unknown,https://docs.fcc.gov/public/attachments/FCC-21-109A1.pdf,https://www.fcc.gov/document/fcc-concludes-core-communications-tariff-investigation
"October 7, 2021",FCC Makes Available Over $163 Million for Broadband in 21 States,"CC Makes Available Over $163 Million for Broadband in 21 States, While Continuing to Clean Up the Rural Digital Opportunity Fund Program",News Relea,"Economics and Analytics, Media Relations, Wireline Competition",unknown,https://docs.fcc.gov/public/attachments/DOC-376391A1.pdf,https://www.fcc.gov/document/fcc-makes-available-over-163-million-broadband-21-states
"October 5, 2021",FCC Announces Tentative Agenda for October Open Meeting,CC Announces Tentative Agenda for October Open Meeting,News Relea,"Managing Director, Media Relation","FCC Acting Chairwoman Jessica Rosenworcel announced the items tentatively on the agenda for the October Open Commission Meeting scheduled for Tuesday, October 26, 2021",https://docs.fcc.gov/public/attachments/DOC-376328A1.pdf,https://www.fcc.gov/document/fcc-announces-tentative-agenda-october-open-meeting-7
"October 5, 2021",FCC Begins Mid-Band Spectrum Auction,CC Begins Mid-Band Spectrum Auction,News Relea,"Media Relations, Economics and Analytics, Wireless Telecommunication",Auction 110 Seeks Bids for Licenses in the 3.45 GHz Band,https://docs.fcc.gov/public/attachments/DOC-376309A1.pdf,https://www.fcc.gov/document/fcc-begins-mid-band-spectrum-auction
"October 4, 2021",Rosenworcel Announces Nat'l Digital Inclusion Week Forum,Acting Chairwoman Rosenworcel Announces National Digital Inclusion Week Forum,News Relea,"Media Relations, Consumer and Governmental Affairs, Office of Chairwoman Rosenworcel",FCC convenes digital inclusion representatives from across the country to learn and exchange ideas to increase connectivity,https://docs.fcc.gov/public/attachments/DOC-376283A1.pdf,https://www.fcc.gov/document/rosenworcel-announces-natl-digital-inclusion-week-forum
"October 4, 2021",Commissioner Simington Announces Staff Changes,Commissioner Simington Announces Staff Changes,News Relea,"Media Relations, Office of Commissioner Simington",Peraza joins to succeed Roddy who departs; Boone appointed as Chief of Staff,https://docs.fcc.gov/public/attachments/DOC-376282A1.pdf,https://www.fcc.gov/document/commissioner-simington-announces-staff-changes
